{
  "$schema": "http://json-schema.org/draft-07/schema#",
  "$id": "https://github.com/software-description-language/spec/layer_platform/platform-connect.schema.json",
  "title": "SDL PlatformConnect",
  "description": "A PlatformConnect is a materialized inter-service connection at layer_platform — the DL inter-Container Connect owned by the platform Container. PlatformConnect objects are generated by the synthesis tool by reading all service dependencies.sdl.json files; they are not hand-authored. Each PlatformConnect represents an edge in the cross-service dependency graph and includes a resolution status so engineers can spot mismatches (a service calls another that has no matching SDL entry).",
  "type": "object",
  "dl": {
    "profile": "software",
    "version": "0.1",
    "concepts": ["Connect"],
    "layer": "semantic",
    "layer_ref": "layer_platform",
    "notes": "PlatformConnect = inter-Container Connect owned by the platform Container. Per DL scoping rule: the Connect is owned by the Container that contains both source and target. Source and target here are service Containers (ServiceActors) inside the platform Container. Generated by synthesis, not hand-authored."
  },
  "required": ["id", "source_service_id", "target_service_id"],
  "additionalProperties": false,
  "properties": {
    "id": {
      "type": "string",
      "description": "Unique identifier for this platform-level connection. Convention: 'source->target' or 'source->target:dependency_id'.",
      "examples": ["order-service->inventory-service", "order-service->payment-service:stripe"]
    },
    "source_service_id": {
      "type": "string",
      "description": "The service that initiates this call. Must reference a service id in the platform manifest.",
      "examples": ["order-service", "payment-service"]
    },
    "target_service_id": {
      "type": "string",
      "description": "The service being called. Must reference a service id in the platform manifest.",
      "examples": ["inventory-service", "payment-service"]
    },
    "protocol": {
      "type": "string",
      "description": "The communication protocol.",
      "enum": ["rest", "grpc", "graphql", "kafka", "rabbitmq", "sqs", "pubsub", "nats", "custom"]
    },
    "style": {
      "type": "string",
      "description": "Whether this connection is synchronous (caller waits) or asynchronous (event-driven, fire-and-forget).",
      "enum": ["sync", "async"]
    },
    "dependency_ref": {
      "type": "object",
      "description": "Reference back to the source Dependency declaration in the service's dependencies.sdl.json.",
      "additionalProperties": false,
      "properties": {
        "service_id":    { "type": "string", "description": "The service that declared this dependency." },
        "dependency_id": { "type": "string", "description": "The dependency id in that service's dependencies.sdl.json." }
      }
    },
    "status": {
      "type": "string",
      "description": "Resolution status of this connection. 'resolved' = both source and target have SDL descriptions and interfaces match. 'unresolved' = dependency declared but no SDL found for the target. 'mismatch' = SDL found but interface or protocol does not align.",
      "enum": ["resolved", "unresolved", "mismatch"]
    },
    "tags": {
      "type": "array",
      "items": { "type": "string" },
      "examples": [["critical-path", "sync", "pci-scope"]]
    },
    "meta": {
      "type": "object",
      "additionalProperties": true
    }
  }
}
